Estado;Lugar;Fechas;Nombre del evento;Email;Teléfono;Liga del evento;Espacio para publicidad gratuita;Espacio para publicidad pagada;Imagen
Baja California Center;Playas de Rosarito;28 de abril al 01 de mayo de 2025;TIANGUIS TURÍSTICO MÉXICO 2025;ivanlopez091977@gmail.com;(664) 624-2000;https://www.tianguisturistico.com;videos, banners, flyers, audios.;videos, banners, flyers, audios;Tianguis_Turistico_logo.jpg 
Papantla, Veracruz;Parque Temático Takilhsukut?y la Zona Arqueológica de El Tajín;19 al 22 de marzo de 2025;CUMBRE TAJÍN ;comunicacion@culturaveracruz.gob.mx;228 818 0412;https://www.facebook.com/CumbreTajinOficial/?locale=es_LA;videos, banners, flyers, audios.;videos, banners, flyers, audios.;https://ventanaver.mx/wp-content/uploads/2025/02/480303886_966845295554282_6479109207167607678_n-780x470.jpg
Coatepec, Veracruz;Salón Texín, Coatepec, Veracruz.;11 al 20 de abril de 2025 ;FESTIVAL INTERNACIONAL DE LA ORQUÍDEA ;http://www.fiomx.com/contacto/;228 109 9155;https://www.facebook.com/FestivalInternacionalOrquidea/?locale=es_LA ;videos, banners, flyers, audios.;videos, banners, flyers, audios.;https://www.gob.mx/cms/uploads/image/file/864931/FIO_2024.jpeg
Guadalajara, Jalisco;Jalisco. Parque Ávila Camacho;07 de junio de 2025 ;FEVINO EL FESTIVAL DEL VINO MEXICANO ;?info@fevino.mx ;;https://www.facebook.com/fevinomx/?locale=es_LA;videos, banners, flyers, audios.;videos, banners, flyers, audios.;https://scontent.fpbc2-1.fna.fbcdn.net/v/t39.30808-6/480180756_1179908996828794_7129317148138085640_n.jpg?_nc_cat=106&ccb=1-7&_nc_sid=6ee11a&_nc_ohc=fdv-5lgsjZQQ7kNvgGIcQMJ&_nc_oc=AdkkwZRrmg6IPE05PUzWeeSQ95YHmJEiNY8sXOTBxVIblEvaIFeoJtBcWi_GzrxuDYm-EEm9Fbs435ggcRPs0p_M&_nc_zt=23&_nc_ht=scontent.fpbc2-1.fna&_nc_gid=rEsNSXMEsu6phi40L2kSuw&oh=00_AYGnKlkfZyRQVi_Zhrq4dk1V1AkRteFy4s9IkbiM7hHZ3A&oe=67F0A910
Ciudad de México;CDMX. Parque Bicentenario;26 de abril de 2025 ;SONORAMA RIBERA MÉXICO 2025 ;holamexico@sonoramaribera.com;;https://www.sonoramariberamexico.com ;videos, banners, flyers, audios.;videos, banners, flyers, audios.;https://imagenes.passline.com/eventos/sonorama-mexico-2025-331481-rec_3.jpg
Aguascalientes, México;Aguascalientes, México;19 abril al 11 de mayo de 2025 ;FERIA NACIONAL DE SAN MARCOS 2025 (FNSM);https://www.facebook.com/PatronatoFNSM/?locale=es_LA;449 910 2088;https://feriasanmarcos.com;videos, banners, flyers, audios. ;videos, banners, flyers, audios.;https://encrypted-tbn0.gstatic.com/images?q=tbn:ANd9GcRQzfX0KaPwIA1PwYRQ7Z2U8MAfGtM_TgZ7Tg&s
